Role,Main Responsibility,Who They Work Closely With,Why This Role Matters,Common Tools/Systems Used,Notes
Operations Manager & Senior Leaders,Oversees Fulfillment Center Operations,"Area Manager, Dept Leads, Safety, Engineering, Corporate",Spots and manages inconsistencies in operations and create plans for smoother fulfillment across the center,"AWS, Databases",Understanding facility perfomance helps create ways to adapt and do better 
Area Manager,Oversees Specific Fulfillment Zones,"Operations Managers, Process Assistants, Warehouse Associates",Makes sure everything in their designated zone is running smoothly and safely,Databases,"Tracks daily numbers (speed and errors rates), implements direct action"
Process Assistants,Delegate Tasks,"Area Manager, Warehouse Associates (Stowers, Pickers, Packers)",Monitors associates in real time and steps in where needed,All systems at the Warehouse Associate Level,Serves as a liasion between Area Managers and  Warehouse Associates
Learning Ambassador,"On-The-Job-Trainers                (Train New Hires, Oversee Workflows, Offer Support, Quality Check) ","Warehouse Associates        (Stowers, Pickers, Packers)",Ensures operations run smoothly and every associate is well informed,All systems at the Warehouse Associate Level,"Keeping the Ambassadors well trained, updated, and informed is crucial "
Stower,Stowes Inventory,"Packers, Pickers",Pickers and Packers rely on this role. Accurate stowing can ensure smoother shipping ,"Scanner, Computer Vision",Proper stowing procedures and storage systems ensure inventory accuracy
Picker,Retrieves Order Item(s) from Inventory,"Stowers, Packers",Ensures the correct item is picked for order processing.,"Computer Vision, Item Tote",Relies on stowing accuracy to ensure proper item is picked for packaging
Packer,Packs Items for Shipping,Pickers,Ensures all items are placed and shipped with the proper order.,"Item Tote, Barcodes, Computer(AI)",This position relies highly on item accuracy